<?xml version="1.0" encoding="UTF-8"?>
<configuration 
	osmosis-home="/export/local-1/public/mapsforge/osmosis-0.38"
	working-dir="/export/local-1/public/mapsforge/mkunis"
	logging-dir="logs" 
	output-dir="out"
	destination-dir="/web/ftp.mapsforge.org/public"  
	xmlns="http://mapsforge.org/mapsforge-preprocessing-conf" xmlns:xsi="http://www.w3.org/2001/XMLSchema-instance" xsi:schemaLocation="http://mapsforge.org/mapsforge-preprocessing-conf mapsforge-preprocessing-conf.xsd ">
  <pipeline name="germany.pbf" output-dir="europe">
    <read-pbf file="files/planet.osm.pbf">
    	<bbox-area-filter maxlat="55.789" minlat="46.624" maxlon="16.432" minlon="4.262" clipIncompleteEntities="true">
    		<polygon-area-filter polygon-file="polygons/germany_simple.poly" clipIncompleteEntities="true">
    			<write-pbf file="germany.osm.pbf" omit-metadata="false" compress="deflate" md5="true"/>
    		</polygon-area-filter>	
    	</bbox-area-filter>
    </read-pbf>
  </pipeline>
  <pipeline name="germany.map" output-dir="europe" >
  	<read-pbf file="out/europe/germany.osm.pbf">
  		<mapfile-writer file="germany-0.2.2.map" type="hd" map-start-position="52.518682,13.376123" md5="true"/>
  	</read-pbf>
  </pipeline>
  <pipeline name="baden-wuerttemberg.map" output-dir="maps/europe/germany">
	<read-pbf file="out/europe/germany.osm.pbf">
		<polygon-area-filter polygon-file="polygons/baden-wuerttemberg.poly" clipIncompleteEntities="true">
			<mapfile-writer file="baden-wuerttemberg-0.2.2.map" type="ram" map-start-position="48.784092,9.181652" md5="true"/>
		</polygon-area-filter>
	</read-pbf>
  </pipeline>
   <pipeline name="bayern.map" output-dir="europe/germany">
	<read-pbf file="out/europe/germany.osm.pbf">
		<polygon-area-filter polygon-file="polygons/bayern.poly" clipIncompleteEntities="true">
			<mapfile-writer file="bayern-0.2.2.map" type="ram" map-start-position="48.140203,11.558347" md5="true"/>
		</polygon-area-filter>
	</read-pbf>
  </pipeline>
   <pipeline name="berlin.map" output-dir="europe/germany">
	<read-pbf file="out/europe/germany.osm.pbf">
		<polygon-area-filter polygon-file="polygons/berlin.poly" clipIncompleteEntities="true">
			<mapfile-writer file="berlin-0.2.2.map" type="ram" map-start-position="52.525582,13.370061" md5="true"/>
		</polygon-area-filter>
	</read-pbf>
  </pipeline>
   <pipeline name="brandenburg.map" output-dir="europe/germany">
	<read-pbf file="out/europe/germany.osm.pbf">
		<polygon-area-filter polygon-file="polygons/brandenburg.poly" clipIncompleteEntities="true">
			<mapfile-writer file="brandenburg-0.2.2.map" type="ram" map-start-position="52.391486,13.06622" md5="true"/>
		</polygon-area-filter>
	</read-pbf>
  </pipeline>
   <pipeline name="bremen.map" output-dir="europe/germany">
	<read-pbf file="out/europe/germany.osm.pbf">
		<polygon-area-filter polygon-file="polygons/bremen.poly" clipIncompleteEntities="true">
			<mapfile-writer file="bremen-0.2.2.map" type="ram" map-start-position="53.083444,8.813782" md5="true"/>
		</polygon-area-filter>
	</read-pbf>
  </pipeline>
   <pipeline name="hamburg.map" output-dir="europe/germany">
	<read-pbf file="out/europe/germany.osm.pbf">
		<polygon-area-filter polygon-file="polygons/hamburg.poly" clipIncompleteEntities="true">
			<mapfile-writer file="hamburg-0.2.2.map" type="ram" map-start-position="53.553223,10.007021" md5="true"/>
		</polygon-area-filter>
	</read-pbf>
  </pipeline>
   <pipeline name="hessen.map" output-dir="europe/germany">
	<read-pbf file="out/europe/germany.osm.pbf">
		<polygon-area-filter polygon-file="polygons/hessen.poly" clipIncompleteEntities="true">
			<mapfile-writer file="hessen-0.2.2.map" type="ram" map-start-position="50.070748,8.243759" md5="true"/>
		</polygon-area-filter>
	</read-pbf>
  </pipeline>
   <pipeline name="mecklenburg-vorpommern.map" output-dir="europe/germany">
	<read-pbf file="out/europe/germany.osm.pbf">
		<polygon-area-filter polygon-file="polygons/mecklenburg-vorpommern.poly" clipIncompleteEntities="true">
			<mapfile-writer file="mecklenburg-vorpommern-0.2.2.map" type="ram" map-start-position="53.634397,11.407306" md5="true"/>
		</polygon-area-filter>
	</read-pbf>
  </pipeline>
   <pipeline name="niedersachsen.map" output-dir="europe/germany">
	<read-pbf file="out/europe/germany.osm.pbf">
		<polygon-area-filter polygon-file="polygons/niedersachsen.poly" clipIncompleteEntities="true">
			<mapfile-writer file="niedersachsen-0.2.2.map" type="ram" map-start-position="52.377014,9.741676" md5="true"/>
		</polygon-area-filter>
	</read-pbf>
  </pipeline>
   <pipeline name="nordrhein-westfalen.map" output-dir="europe/germany">
	<read-pbf file="out/europe/germany.osm.pbf">
		<polygon-area-filter polygon-file="polygons/nordrhein-westfalen.poly" clipIncompleteEntities="true">
			<mapfile-writer file="nordrhein-westfalen-0.2.2.map" type="ram" map-start-position="51.219707,6.794465" md5="true"/>
		</polygon-area-filter>
	</read-pbf>
  </pipeline>
   <pipeline name="rheinland-pfalz.map" output-dir="europe/germany">
	<read-pbf file="out/europe/germany.osm.pbf">
		<polygon-area-filter polygon-file="polygons/rheinland-pfalz.poly" clipIncompleteEntities="true">
			<mapfile-writer file="rheinland-pfalz-0.2.2.map" type="ram" map-start-position="50.001105,8.258736" md5="true"/>
		</polygon-area-filter>
	</read-pbf>
  </pipeline>
   <pipeline name="saarland.map" output-dir="europe/germany">
	<read-pbf file="out/europe/germany.osm.pbf">
		<polygon-area-filter polygon-file="polygons/saarland.poly" clipIncompleteEntities="true">
			<mapfile-writer file="saarland-0.2.2.map" type="ram" map-start-position="49.241166,6.990352" md5="true"/>
		</polygon-area-filter>
	</read-pbf>
  </pipeline>
   <pipeline name="sachsen-anhalt.map" output-dir="europe/germany">
	<read-pbf file="out/europe/germany.osm.pbf">
		<polygon-area-filter polygon-file="polygons/sachsen-anhalt.poly" clipIncompleteEntities="true">
			<mapfile-writer file="sachsen-anhalt-0.2.2.map" type="ram" map-start-position="52.130669,11.628792" md5="true"/>
		</polygon-area-filter>
	</read-pbf>
  </pipeline>
   <pipeline name="sachsen.map" output-dir="europe/germany">
	<read-pbf file="out/europe/germany.osm.pbf">
		<polygon-area-filter polygon-file="polygons/sachsen.poly" clipIncompleteEntities="true">
			<mapfile-writer file="sachsen-0.2.2.map" type="ram" map-start-position="51.040557,13.731966" md5="true"/>
		</polygon-area-filter>
	</read-pbf>
  </pipeline>
   <pipeline name="schleswig-holstein.map" output-dir="europe/germany">
	<read-pbf file="out/europe/germany.osm.pbf">
		<polygon-area-filter polygon-file="polygons/schleswig-holstein.poly" clipIncompleteEntities="true">
			<mapfile-writer file="schleswig-holstein-0.2.2.map" type="ram" map-start-position="54.314971,10.13190" md5="true"/>
		</polygon-area-filter>
	</read-pbf>
  </pipeline>
   <pipeline name="thueringen.map" output-dir="europe/germany">
	<read-pbf file="out/europe/germany.osm.pbf">
		<polygon-area-filter polygon-file="polygons/thueringen.poly" clipIncompleteEntities="true">
			<mapfile-writer file="thueringen-0.2.2.map" type="ram" map-start-position="50.972535,11.038556" md5="true"/>
		</polygon-area-filter>
	</read-pbf>
  </pipeline>
</configuration>
